Title,Source,Published Date,URL,Content
〈美股早盤〉債務上限僵局令投資人不安 主要指數開低,Yahoo Entertainment,2023-05-24T05:53:51Z,https://tw.stock.yahoo.com/news/%E7%BE%8E%E8%82%A1%E6%97%A9%E7%9B%A4-%E5%82%B5%E5%8B%99%E4%B8%8A%E9%99%90%E5%83%B5%E5%B1%80%E4%BB%A4%E6%8A%95%E8%B3%87%E4%BA%BA%E4%B8%8D%E5%AE%89-%E4%B8%BB%E8%A6%81%E6%8C%87%E6%95%B8%E9%96%8B%E4%BD%8E-135351359.html,"白宮和宮和黨代表就提高債務上限的新一輪談判未能取得突破，令投資人緊張不安，與此同時對全球經濟前景悲觀情緒日益加劇，美股主要指數周三（24 日）開低。

截稿前，道瓊工業指數下跌近 200 點或近 0.6%，那斯達克綜合指數跌近 90 點或 0.7%，標普 500 指數跌近 0.7%，費城半導體指數跌近 2%。

美國眾議院議長麥卡錫昨日表示，協議還沒有達成，但認為仍然可以在 6 月 1 日之前達成協議。據悉，雙方在支出方面仍存在重大分歧，目前沒有安排任何談判。據眾議院議長麥卡錫在當天的共和黨閉門會議上表示，他們離達成協議「還差得很遠」。評論稱債務談判的緊迫性因此大打折扣。聯準會（Fed）主席鮑爾與民主黨眾議員會面時對債務上限問題避而不談。

不過多家外媒援引知情人士消息指出，雙方將於美國時間周三上午重新談判，尋求就高美國 31.4 兆美元的債務上限達成協議，避免災難性的違約。

Fed 將於台灣時間周四兩點公布五月會議紀錄，投資人將密切關注 Fed 未來利率路徑的線索。該次會議上，Fed 進行此輪周期中的連續第十次升息，目前的焦點是 Fed 是否會在 6 月的會議上暫停升息。

Fed 主席鮑爾上周談話時提到，有鑑於近期一連串銀行倒閉造成信貸環境收緊，可能會暫停升息。然而，Fed「鷹王」布拉德日前表示，今年仍然需要在升息兩次，新「鷹王」卡什卡里也表示，Fed 應該在 6 月發出訊號，即便這此暫停升息也不意味著緊縮政策結束。

其他市場方面，英國通膨高燒難退，粉碎英國央行（BOE）暫停升息的預期。貨幣市場目前預估 BOE 的利率最高將達到 5.5%，這意味著年底前將整整升息 4 碼。

具體來看，英國 4 月消費者物價指數（CPI）年增 8.7%，高於預期 8.3%，前值為 10.1%，核心 CPI 年增 6.8%，高於預期與前值 6.2%。按月來看，4 月 CPI 成長 1.2%，高於預期與前值 0.8%，核心 CPI 成長 1.3%，也高於預期的 0.8% 與前值的 0.9%。

大宗商品方面，金屬價格普遍走低，倫敦交易所（LME）的銅庫存自 4 月中旬以來幾乎翻了一番，從這一點可以明顯看出銅需求疲軟。

截至台北時間周三（24 日）21 時許：

焦點個股：

蘋果 (AAPL-US) 早盤上漲 0.3%，至每股 172.07 美元

蘋果全球開發者大會（WWDC）將台灣時間 6 月 6 日至 10 日以線上方式舉行，開發者和學生有機會在開幕當天到加州 Apple Park 現場參加。其中今年 WWDC 最重要的主題演講定於台灣時間 6 月 6 日凌晨 1 點舉行，市場預估蘋果屆時將公布混合時境（MR）頭戴式裝置、15 吋 MacBook Air 以及 iOS、iPadOS、macOS 等一系列更新。

特斯拉 (TSLA-US) 早盤下跌 1.88%，至每股 182.27 美元

美國電動車龍頭執行長馬斯克日前表示，已向特斯拉董事會選定一位接班人，如果自己發生意外此人將接管公司，不過他並未透露這位接班人的姓名。特斯拉內部猜測，馬斯克屬意的下任特斯拉執行長很可能是目前的財務長 Zachary Kirkhorn。而近年來頗受馬斯克重用的高層，特斯拉中華區負責人朱曉彤也是可能的人選之一。

Alphabet(GOOGL-US) 早盤下跌 1.03%，至每股 121.30 美元

Alphabet 旗下 Google 日前發布一款新的對話式聊天機器人，它將協助廣告商製作廣告。Google 表示，廣告商可以輸入自己的網站，人工智慧（AI）聊天機器人將幫助草擬標題、選定特定關鍵詞和圖片來吸引消費者。

今日關鍵經濟數據：

無

華爾街分析：

加拿大皇家銀行 Brewin Dolphin 市場分析主管 Janet Mui 表示，預估美國經濟將步入衰退，因為預期利率將維持在高處，對經濟和企業利潤都是負面影響。這一看法與市場目前定價背道而馳，市場認為有鑑於就業市場仍強凸顯美國經濟仍有彈性、Fed 升息腳步放慢，有望實現「軟著陸」。

貝萊德國際 EMEA 基本固定收益部門主管 Michael Krautzberger 也對美國經濟前景感到悲觀，他認為隨著債務上限最後期限逼近，該問題帶來的波動是看淡前景的原因之一，但預料不會出現技術性違約，會在最後一刻達成協議。

更多鉅亨報導

•Fed推出新指標 用逾400萬條推文預測升息幅度、股價走勢

•美債限談判卡關 鮑爾重申Fed沒有扭轉違約後果的工具"
"After Bullish Report In March, Salesforce Stock Ramps Higher Ahead Of Results; 3 Security Software Stocks To Watch",Investor's Business Daily,2023-05-26T14:27:25Z,https://www.investors.com/research/earnings-preview/salesforce-stock-ramps-higher-earnings-3-security-software-stocks-to-watch/,"After Bullish Report In March, Salesforce Stock Ramps Higher Ahead Of Results; 3 Security Software Stocks To Watch"
Wednesday links: the hardest day to invest,Biztoc.com,2023-05-24T18:16:15Z,https://biztoc.com/x/b5f1828967efdfa3,"Markets

Bank stocks used to be boring to trade. Not any more. (wsj.com)

Companies have not not shy about buying back stock YTD. (wsj.com)

Apple

Apple ($AAPL) is going to work more closely with Broadcom ($BRCM) on 5G chips. (wsj.com)

Microsoft ($MSFT) is in the lead on AI. What's Apple's ($AAPL) next move? (stratechery.com)

Why Apple ($AAPL) is seemingly lagging in AI.…

This story appeared on abnormalreturns.com , 2023-05-24."
Stocks sink as debt crunch continues: Stock market news today,Yahoo Entertainment,2023-05-23T20:01:37Z,https://finance.yahoo.com/news/stocks-sink-as-debt-crunch-continues-stock-market-news-today-160957990.html,"US stocks closed lower Tuesday on Wall Street concerns that the debt-ceiling debate in Washington won't reach a resolution.

The S&P 500 (^GSPC) ended the session down 1.12%. The Dow Jones Industrial Average (^DJI) dipped 0.69%, or more than 200 points. The technology-heavy Nasdaq Composite (^IXIC) declined more than 1.26%.

In Treasuries, yields moved lower across the curve Tuesday, with the benchmark 10-year yield edged down to 3.7%. Two-year yields climbed to 4.34%, and those on the 30-year bond ticked lower to 3.95%. The extended losses came as worries over the debt-ceiling standoff intensified, as the prospect of a default moves closer.

Tuesday's negotiation talks initially provided some hope a deal could be reached. That followed optimistic remarks from President Biden and House Speaker Kevin McCarthy the previous day.

But McCarthy reportedly said in a closed-door meeting to Republican colleagues that ""we are nowhere near a deal yet"" hours after saying in the Oval Office ""I think, at the end of the day, we can find common ground.""

The back-and-forth has left investors on edge in the countdown to the June 1 ""X-date"", which is when Treasury Secretary Janet Yellen said a default is likely to come.

“Our base case remains that the debt ceiling ultimately does get lifted/suspended though the journey to that end could be at the eleventh hour and drive significantly higher market instability than appreciated by the market currently,” Dubravko Lakos, chief US equity strategist at JPMorgan, wrote in a note Monday.

“We expect a temporary/comprehensive deal on the debt ceiling to negatively impact federal spending and for a likely contentious budget negotiation process later this year,” Lakos added.

On the economic front, S&P Global's flash US composite PMI, which captures activity in both the services and manufacturing sectors, came in at 54.5 in May, up from 53.4 in April and better than the 53.0 estimated by economists, marking a 13-month gain for the index.

Separately, new single-family home sales rose 4.1% in April to an annualized pace of 683,000, above the revised rate of 656,000, according to a report from the Census Bureau. That's still 11.8% above the year-ago level and higher than the Bloomberg consensus expectations of 665,000 units for April.

In single stock moves, shares of Yelp Inc. (YELP) rallied over 5% as activist investor TCS Capital Management confirmed its stake in the company and asked the company to explore strategic alternatives including a sale, according to an open letter to the Yelp board of directors on Tuesday.

Lowe's Companies, Inc. (LOW) shares gained more 2% after the home-improvement company cut its full-year sales forecast Tuesday, citing lower demand as high inflation impacts discretionary spending. While Apple (AAPL) said it has entered a multi-billion dollar deal with chipmaker Broadcom Inc. (AVGO) to use chips made in the US. Shares of the tech giant slid more than 1%.

Elsewhere, shares of Dick's Sporting Goods (DKS) moved lower after the company topped its first fiscal quarter sales and earnings while maintaining its outlook for this year

Zoom Video Communications, Inc. (ZM) shares dropped more than 7% after the videoconferencing software company posted a beat on their results for its fiscal first quarter. The company also raised its full-year guidance.

Shares of Pfizer Inc. (PFE) rose after a study showed positive weight-loss results for patients taking the drug maker’s oral diabetes treatment.

BJ's Wholesale Club Holdings, Inc. (BJ) shares declined more than 7% after the retailer reported revenue that came in below analysts' expectations. Comparable club sales not including gasoline were lower than anticipated.

In the meantime, Netflix (NFLX) is cracking down on password sharing in the US. The company broke the news in a blog post Tuesday afternoon.

After the closing bell, Palo Alto Networks, Inc. (PANW), Intuit Inc. (INTU), and Toll Brothers, Inc. (TOL) are expected to report results.

_____

Dani Romero is a reporter for Yahoo Finance. Follow her on Twitter @daniromerotv

Click here for the latest stock market news and in-depth analysis, including events that move stocks

Read the latest financial and business news from Yahoo Finance

Download the Yahoo Finance app for Apple or Android

Follow Yahoo Finance on Twitter, Facebook, Instagram, Flipboard, LinkedIn, and YouTube"
3 AI Stocks Warren Buffett Is Betting On,Yahoo Entertainment,2023-05-26T19:43:32Z,https://finance.yahoo.com/news/3-ai-stocks-warren-buffett-194332954.html,"ardasavasciogullari / Getty Images

Warren Buffett, the billionaire CEO of Berkshire Hathaway, hasn’t earned the nickname “The Oracle of Omaha” for nothing. His company’s stock doubled the annual return of the S&P 500 from 1965 to 2022, returning 19.8% on average annually vs. the S&P 500’s 9.9%.

How To Buy ChatGPT Stock: Your 2023 Guide to AI Investing

Learn: 3 Things You Must Do When Your Savings Reach $50,000

In addition to his folksy wisdom, Buffett is also known for his general reluctance to buy tech stocks. But what may surprise some investors is that one popular tech stock — with important exposure to artificial intelligence — actually makes up nearly half of the Berkshire Hathaway investment portfolio, and the company has small stakes in other AI-related companies as well. Here’s a look at some of the prominent AI stocks that Warren Buffett is betting on.

Apple (AAPL)

When it comes to AI-related stocks — and tech stocks in general — Apple is really the beginning and the end of the discussion. After shunning tech stocks for decades, Buffett made a major shift on May 16, 2016, picking up nearly 10 million shares of Apple at a split-adjusted price of about $6.81.

Now trading at about $171 per share, Apple has posted huge gains on Buffett’s original purchase. Although Buffett has occasionally trimmed Berkshire’s Apple position, it now sits at a whopping 47% of the company’s entire investment portfolio.

Take Our Poll: Who Has Given You the Best Money Advice You Have Ever Received?

Regardless of what other AI stocks Berkshire might dabble in, it’s clear that the company’s big bet is on Apple.

Buffett has said he views Apple not as a tech company but as a consumer products business. In that field, Buffett sees Apple as the best of the best. In fact, at the Berkshire Hathaway annual shareholders meeting in May 2023, Buffett said Apple “just happens to be a better business than any we own.” Regarding Apple’s iPhone, Buffett said that if people “had to give up a second car or give up their iPhone, they give up their second car.”

Apple already has begun integrating AI into its product line. CEO Tim Cook said AI will eventually “affect every product and service we have.” Two of the company’s signature products, the iPhone and the Apple Watch, already use an AI-powered crash detection feature, and the Apple Watch also has an electrocardiogram feature.

In its quest to continue its dominance in the consumer products world, Apple seems poised to rapidly integrate AI into its stable.

Amazon (AMZN)

Amazon is Berkshire Hathaway’s other primary bet in the tech/AI industry, although it’s a far cry from the company’s love of Apple. Currently, Amazon represents just 0.4% of Berkshire Hathaway’s portfolio — although it’s still a $1.2 billion investment.

Berkshire Hathaway began buying Amazon in 2019, and Buffett has said he was “an idiot for not buying it [sooner].” Even though the stock still appears in the Berkshire Hathaway portfolio — and Buffett is a fan — the CEO wasn’t the one who actually initiated the position.

As Buffett told CNBC at the time, “One of the fellows in the office that manage money … bought some Amazon,” referring to either Todd Combs or Ted Weschler, his two main portfolio managers.

Although Amazon might not seem like a “classic” Buffett stock, it does have many of the competitive advantages that he has long espoused. From the economic “moat” around its business — which is hard for competitors to breach — to its customer satisfaction levels and excellent management, Amazon has many of the characteristics that make it a so-called “Buffett stock.” But Amazon’s also becoming a big player in the AI world.

The company recently made a big splash with its rollout of Bedrock, a direct competitor of ChatGPT that could revolutionize the industry. As told to TechCrunch, Vasi Philomin, VP of generative AI at Amazon Web Services, said Bedrock will apply “machine learning to the real world — solving real business problems at scale. … We think every application out there can be reimagined with generative AI.”

Snowflake (SNOW)

A somewhat lesser-known AI name favored by Buffett is Snowflake. Representing just 0.3% of the Berkshire Hathaway portfolio, the Snowflake position is worth “only” about $907 million. But it does reflect Buffett’s evolving opinion of the types of stocks he should own, even though it’s likely one of his portfolio managers did the actual buying.

Snowflake’s platform, according to the company itself, “was designed from the ground up to support machine learning and AI-driven data science applications.” The cloud data warehouse company stores, processes and analyzes company information in conjunction with prominent cloud platforms Amazon Web Services, Google Cloud Platform and Microsoft Azure.

While this could position the company for explosive future growth, it’s possible that Berkshire Hathaway bought into Snowflake because it was able to get shares in what was a very hot IPO in 2020.

More From GOBankingRates

This article originally appeared on GOBankingRates.com: 3 AI Stocks Warren Buffett Is Betting On"
Why a Meta-Magic Leap partnership makes sense – and may or (may not) be all about Apple,Yahoo Entertainment,2023-05-23T20:09:57Z,https://finance.yahoo.com/news/why-a-meta-magic-leap-partnership-makes-sense--and-may-or-may-not-be-all-about-apple-200957753.html,"Why a Meta-Magic Leap partnership makes sense – and may or (may not) be all about Apple

Meta (META) is reportedly in talks with augmented reality (AR) headset maker Magic Leap to license its tech. It's a deal that would make a lot of sense, as the possible drop of Apple's (AAPL) mixed reality headset draws nearer.

The ""why"" is really simple – mixed reality, by definition, requires both virtual reality (VR) and AR, and so far, Meta has focused on VR. AR provides a new avenue for Meta, which has had to battle VR skepticism, dwindling metaverse interest, and a cash-burning research and product operation that's far from profitable.

""Metaverse interest has cooled down in the past several months, but that doesn’t mean it is dead altogether,"" said IDC Research Director Ramon Llamas. ""Meta’s efforts with all things AI can be leveraged within AR and VR. Magic Leap can help extend that into the AR realm.""

A deal with Magic Leap would also lend Meta serious AR credibility, said Cathy Hackl, Journey Chief Futurist & Chief Metaverse Officer.

""If Meta licenses Magic Leap's visual tech, that would help Meta move faster with its AR glasses ambitions,"" said Hackl. ""The optics/waveguide tech work that [Magic Leap] has worked on is something very few companies have ever worked on to the degree that they have.""

Hackl, who worked at Magic Leap from 2018 to 2020, said the Florida-based company also has a lot of credibility when it comes to the metaverse – in fact, Magic Leap's ex-Chief Futurist Neal Stephenson, a famed science fiction writer, is credited with coining the term ""metaverse.""

LAS VEGAS, NEVADA - JANUARY 06: Attendee Jason Nguyen uses augmented reality (AR) glasses in a simulation at the Magic Leap booth during CES 2023 at the Las Vegas Convention Center on January 6, 2023 in Las Vegas, Nevada. CES, the world's largest annual consumer technology trade show, runs through January 08 and features about 3,200 exhibitors showing off their latest products and services to more than 100,000 attendees. (Photo by David Becker/Getty Images)

""When I worked at Magic Leap, many of us thought Magic Leap would be the next Apple or the next tech juggernaut,"" said Hackl. ""That didn't turn out to be the case, but when I was there, the metaverse as a concept many of us were discussing with enterprise clients or a topic we would often mention on stage at conferences talking about the work we were doing toward building it, so I would say Magic Leap would have as strong a metaverse cred as any company that has been innovating and creating new products and processes in this specific space. What Magic Leap was able to accomplish as a startup was impressive despite the criticism it has gotten.""

Magic Leap, founded in 2010, has been subject of criticism for attracting billions in investments yet developing a still-imperfect mixed reality headset.

It's not just about Apple, experts say

It certainly seems more than coincidental that there are reports of Meta pursuing Magic Leap just a couple weeks before Apple's Worldwide Developers Conference, the event at which the company's expected to finally reveal its mixed reality headset. However, both Hackl and Llamas are skeptical that this is just about Meta keeping its lead over Apple.

""It allows Meta to enter the AR glasses space faster,"" said Hackl. ""Is a Magic Leap partnership enough to help Meta fend off Apple? I think you're asking the wrong question. I think what this partnership allows Meta is to become a more serious player in the AR glasses space and gives them an opportunity to tap into what [Magic Leap] has already created.""

Llamas agrees that this can't be all about the specter of Apple.

""As for fending off Apple, I wouldn’t say that it is the primary reason,"" said Llamas. ""If anything, both companies bring a set of skills and expertise to the table that the other may not necessarily have, and allows them to pursue a bigger total-available-market that neither could do independently.""

So, in the end, for Meta, as much as anything else, this is at least as much about growing that addressable market and the technology at their disposal, as it is about growing competition, he told Yahoo Finance.

""What I’d really like to see is Meta’s and Magic Leap’s respective experiences become available across both AR and VR,"" said Llamas. ""That’s not an easy thing to do, but assuming that Meta and Magic Leap can pull it off, that puts them in very strong position to meet more customers.""

Allie Garfinkle is a Senior Tech Reporter at Yahoo Finance. Follow her on Twitter at @agarfinks and on LinkedIn.

Click here for the latest trending stock tickers of the Yahoo Finance platform.

Read the latest financial and business news from Yahoo Finance.

Download the Yahoo Finance app for Apple or Android.

Follow Yahoo Finance on Twitter, Facebook, Instagram, LinkedIn, and YouTube."
Apple closes in on a $3 trillion stock market valuation,Yahoo Entertainment,2023-05-23T12:01:18Z,https://finance.yahoo.com/news/apple-closes-in-on-a-3-trillion-stock-market-valuation-120118264.html,"A few more bites out of Apple's (AAPL) stock by investors, and we may find the tech giant's market cap beyond the $3 trillion level.

Shares of the iPhone maker have surged 35% year to date, out-performing the S&P 500 pedestrian's 9% gain. Apple is the fourth-best performing component of the closely tracked FAANG (Facebook, Apple, Amazon, Netflix, Google) complex, lagging the 105% gain in Meta (META), 41% increase in Alphabet (GOOG, GOOGL), and 39% appreciation in Amazon (AMZN).

In the process of its push higher, Apple has added about $690 billion in market cap. The company's stock market valuation now stands at $2.74 trillion, according to Yahoo Finance data, only 9% away from the $3 trillion mark.

Apple is the highest-valued company in the stock market, with Microsoft (MSFT) a close second, sporting a $2.38 trillion market cap.

Pros point to several reasons behind the impressive run in Apple's stock.

First, Apple continues to have a great story to tell investors on multiple fronts.

""For Apple there is massive installed base momentum going to the iPhone 15 anniversary cycle, and it has put a tailwind in the stock coupled by demand being solid in the field,"" Wedbush analyst Dan Ives tells Yahoo Finance.

That two could become a three soon. (Photo by Gareth Cattermole/Getty Images)

That installed base momentum could be stoked further at the company's 2023 Worldwide Developers Conference, which kicks off June 5.

Apple is widely anticipated to introduce the iOS 17 operating system. But some Apple watchers are holding out hope the company finally unveils its new AR/VR headset that has been in the works for years.

Meantime, Apple's latest quarterly results — while not perfect — have been viewed favorably by investors looking for relative safety amid the debt ceiling drama and sticky inflation.

""Overall, the results [from Apple] and guidance are exactly what investors were looking for from the company to feel reassured of its defensive positioning and at the same time the greater resilience of Big Tech in general in the current macro as well as on potential further macro deterioration, making it palpable to still keep paying 26x near-term earnings for Apple shares,"" said JP Morgan analyst Samik Chatterjee in a client note.

Chatterjee added: ""While we can see some investors squirm about a 26x earnings multiple, we believe the resilience of the business proving out in the numbers currently as well as the early part of the pandemic (2020) will amply justify the reasons to pay a premium.""

FILE - In this May 7, 2018, photo, Berkshire Hathaway Chairman and CEO Warren Buffett smiles during an interview in Omaha, Neb. (AP Photo/Nati Harnik, File)

Another vote of confidence from a special investor has helped sentiment on Apple, too.

Billionaire investor and Berkshire Hathaway CEO Warren Buffett said earlier this month he purchased more shares of Apple. Berkshire now owns a $151 billion stake in Apple, up from $1 billion in May 2016.

Berkshire is Apple's third-largest institutional shareholder, behind BlackRock (second) and Vanguard (one), according to Yahoo Finance data.

""Apple is different than the other businesses we own. It just happens to be a better business,"" Buffett said at the Berkshire Hathaway annual meeting earlier in May.

As for what could trip up Apple's stock, pros find it hard to come up with a major selling event. Many highlight China's economic recovery stalling as a key risk to Apple's stock price in 2023, however.

Said Ives: ""Outside of the usual black swan events, the biggest risk to Apple’s stock is around the demand environment in China taking a step down. China is the hearts and lungs of the Apple growth story and so far so good, but that is the biggest risk for the stock.""

Brian Sozzi is Yahoo Finance's Executive Editor. Follow Sozzi on Twitter @BrianSozzi and on LinkedIn. Tips on the banking crisis? Email brian.sozzi@yahoofinance.com

For the latest earnings reports and analysis, earnings whispers and expectations, and company earnings news, click here

Read the latest financial and business news from Yahoo Finance"
