Title,Source,Published Date,URL,Content
Apple Just Announced a Multibillion-Dollar Deal With Broadcom -- Here's What Investors Should Know,Motley Fool,2023-05-23T20:20:46Z,https://www.fool.com/investing/2023/05/23/apple-just-announced-a-multibillion-dollar-deal-wi/,"In early 2018, Apple (AAPL 1.41%) announced plans to invest $350 billion in the U.S. economy. At the time, the company said this set of investments would be concentrated on those areas where Apple could have the ""greatest impact on job creation."" These included direct employee hiring, spending and investment involving domestic manufacturers and suppliers, and fueling the ""fast-growing app economy.""

The tech giant later raised that commitment to $430 billion over five years, including a proposed campus in North Carolina and greater investment in 5G technology.

Apple just took another big step in fulfilling its pledge, striking a multiyear, multibillion-dollar deal with chipmaker Broadcom (AVGO 11.52%) to create components for its devices that will be made in the U.S.

A big focus on 5G

In a press release on Tuesday, Apple said it struck a major deal with Broadcom for a variety of 5G radio frequency components. The technology, which will be developed by Broadcom, will include Film Bulk Acoustic Resonator (FBAR) filters, which are precision electronic filters that help focus inbound and outbound wireless signals, while reducing interference, which ensures it transmits and receives only those communications intended for that specific device.

The agreement also covers a number of other ""cutting-edge wireless connectivity components."" Apple noted that the FBAR filters would be ""designed and built in several key American manufacturing and technology hubs, including Fort Collins, Colorado, where Broadcom has a major facility."" Apple said it already helps support 1,100 jobs at the plant and ""the partnership will enable Broadcom to continue to invest in critical automation projects and upskilling with technicians and engineers.""

A regulatory filing by Broadcom revealed the company had entered into two separate multiyear agreements with Apple, ""for the supply of a range of specified high-performance RF and wireless components and modules for use in Apple products."" The filing was mum as to the specific value of each deal.

Apple launched its 5G-enabled iPhone in 2020 and has since expanded the technology to other devices including the iPad Pro and Apple Watch.

Broadcom investors rejoice

This is welcome news for Broadcom shareholders, who have been justifiably concerned about the prospect of losing a large portion of its annual sales from the iPhone maker. In recent months, there have been multiple reports suggesting that Apple planned to part ways with Broadcom, replacing a number of Wi-Fi and Bluetooth processors in favor of chips of its own design.

The iPhone maker is reportedly Broadcom's largest single customer in its most recent fiscal year, representing roughly 20% of Broadcom's revenue, or about $7 billion. If the reports were true, it was expected to hit Broadcom's sales to the tune of $1 billion to $1.5 billion, according to estimates by AB Bernstein analyst Stacy Rasgon.

What it means for Apple

Like so many companies, Apple struggled with supply chain and logistics issues during the pandemic. Over the past couple of years, the company was hit by widespread product delays due to its heavy dependance on manufacturers in China and the concentration of its suppliers.

Since then, Apple has been working to restructure its supply chain to reduce its reliance on the country, after suffering a supply shortage of its signature iPhone during its crucial holiday season as well as longer-than-normal shipping delays. Apple has been expanding its manufacturing into new countries, including Vietnam, Malaysia, and India, to reduce this risk. Furthermore, Apple will be moving the production of some of its semiconductors to a new foundry in Arizona, being constructed by Taiwan Semiconductor Manufacturing.

While there's no way to quantify the deal for Apple, this is just another sign of the progress the company is making to reduce the risk of future supply chain disruptions."
"Amid the Deal with Apple, Is It Too Late to Buy Broadcom Stock?",Motley Fool,2023-05-26T09:25:00Z,https://www.fool.com/investing/2023/05/26/amid-deal-apple-too-late-buy-broadcom-stock/,"In a move that surprised some investors and analysts, Apple (AAPL 1.41%) signed a new multi-billion deal with Broadcom (AVGO 11.52%), which will drive the development of components related to 5G radio frequencies. The announcement sent Broadcom stock higher as the relationship between the two companies expanded.

Of course, this semiconductor stock was already on the rise before the announcement, so the added news now has the stock trading at record highs. Given its already elevated stock price, does this latest deal make Broadcom a buy, or did investors miss their opportunity?

The Apple-Broadcom deal

Broadcom's chip segment develops semiconductors for other companies. It invests billions per year in research and development, and it employs engineers near its large clients to develop solutions collaboratively. One fan of its approach is Apple, which was an important Broadcom client before this deal. Broadcom designs the chips that power the Wi-Fi hotspot for the iPhone and other products, and this relationship accounted for about 20% of Broadcom's revenue in 2022.

Much remains unknown about the new deal. Neither company disclosed financial terms, although Apple said the agreement was part of a commitment made in 2021 to invest $430 billion in the U.S. economy.

Moreover, Apple has recently brought more chip development in-house and wanted to develop its own Wi-Fi and Bluetooth chips, according to a Bloomberg report. Until recently, this led to fears that Apple would scale back its relationship with Broadcom. Hence investors probably looked at this perceived turnabout as a surprise.

The state of Broadcom's stock

As mentioned before, investors expressed their surprise at the deal by bidding Broadcom stock up to record highs. Consequently, Broadcom's stock price is up more than 25% over the last 12 months.

And even after declining for most of 2022, revenue and profits continue to surge. In the first quarter of fiscal 2023 (ended Jan. 29), revenue of $8.9 billion rose 12% year over year, primarily driven by a 17% increase in product sales.

During that time, it limited increases in the cost of revenue and reduced operating expenses. That helped it report a quarterly net income of $3.8 billion, rising 57% compared to the same quarter in fiscal 2022.

Surprisingly, its rising stock price has not made Broadcom an expensive stock, as it sells at a P/E ratio of 23. That multiple is above multi-year lows, but it still trades at a lower valuation than Apple, Nvidia, and Advanced Micro Devices. Additionally, Broadcom remains one of the more lucrative dividend stocks in the semiconductor industry. At $18.40 per share annually, it claims a dividend yield of about 2.5%, well above the 1.6% average of the S&P 500.

Also, that payout has risen annually since 2011, with the dividend increasing by 12% after the most recent increase. This cash return provided stability amid the stock's considerable growth. And because the company's $3.9 billion quarterly free cash flow far exceeded the $1.9 billion dividend cost for the period, its payout should stay safe.

Should I consider Broadcom?

Despite a multi-billion deal with Apple, it is not too late to buy Broadcom stock. Admittedly, most investors would probably like more details on the terms of this specific deal.

However, Broadcom posted solid growth in fiscal Q1 before the deal. Due to its P/E ratio of 23 and a high dividend, the stock appears undervalued. And with the company strengthening its relationship with Apple, Broadcom stock will likely continue to move higher over time."
3 Top AI Stocks That Pay Dividends -- and 1 Yields Over 5%,Motley Fool,2023-05-25T09:52:00Z,https://www.fool.com/investing/2023/05/25/3-top-ai-stocks-that-pay-dividends-1-yields-over-5/,"Income investors can find their portfolios loaded with boring companies. That's not a bad thing, though. Boring companies often provide the most reliable dividends.

However, it's possible to receive income and invest in one of the most exciting opportunities on the planet -- artificial intelligence (AI). Here are three top AI stocks that pay dividends.

1. IBM

IBM (IBM 1.68%) has been a favorite for income investors for years, and it still is. The tech giant offers a dividend yield of nearly 5.2%. IBM has paid a dividend in every quarter since 1916 and increased its dividend for 28 consecutive years.

Sure, IBM hasn't been at the center of attention with the recent surge in interest in AI. However, the company has been an AI pioneer for a long time. For example, its Watson technology made headlines in 2011 by beating Jeopardy! champions Brad Rutter and Ken Jennings.

But is IBM still a contender in AI? Yep. IBM remains an industry leader in the number of AI patents held. Gartner's Magic Quadrant ranks the company as a leader in conversational AI. IBM Watson is now being used across of wide range of industries.

2. Microsoft

Unlike IBM, Microsoft (MSFT 2.14%) has been at the forefront of the AI world this year. The company has invested billions of dollars in OpenAI, the maker of ChatGPT. Microsoft has also integrated OpenAI's generative AI technology into its products, including its Bing search engine.

These AI efforts have caught investors' attention. Microsoft stock is up more than 30% year to date, largely as a result of its AI-related moves. CEO Satya Nadella proclaimed in Microsoft's recent quarterly conference call that the company is ""going to lead in the AI era.""

While Microsoft is well-known these days for its AI leadership, it's easy to forget that the company offers a dividend, but its yield of under 0.9% isn't anything to get excited about. However, Microsoft has increased its dividend for 13 consecutive years. It's also in a strong financial position to keep that streak going.

3. Apple

Apple (AAPL 1.41%) reigns as the largest company in the world, based on market cap. But the huge technology company doesn't get much attention these days for its AI expertise or its dividend.

The company's Siri virtual assistant is still one of the most widely used AI tools, although it seems dated after the introduction of ChatGPT. Apple CEO Tim Cook recently stated that the company ""view[s] AI as huge.""

He added that Apple plans to ""continue weaving it in our products on a very thoughtful basis."" Recent staff recruiting by the company indicates that it's accelerating its efforts in multiple areas of AI development.

Apple's dividend is the lowest of these three AI stocks, with a yield of under 0.6%. But the company has increased its dividend every year since initiating the program in 2012. Apple also has plenty of financial flexibility to continue boosting its dividend payout in the future.

Are they buys?

My view is that all three of these AI dividend stocks are solid picks, depending on your investing style. Income investors will probably like IBM the most since it pays the most attractive dividend. Growth investors will be more interested in Apple and Microsoft, both of which should be able to capitalize on the AI boom in the coming years."
L'indicateur de géolocalisation de macOS 13.4 imite parfaitement celui d'iOS,MacGeneration,2023-05-26T13:15:33Z,https://www.macg.co/macos/2023/05/lindicateur-de-geolocalisation-de-macos-134-imite-parfaitement-celui-dios-137095,"À peine intégré dans macOS, l'indicateur de géolocalisation a été discrètement modifié. Dans macOS 13.3, ce nouvel indicateur, qui apparait lorsqu'une application utilise votre géolocalisation, prenait juste la forme d'un petit point bleu dans la barre des menus, à droite du bouton qui sert à ouvrir le centre de contrôle.

L'indicateur de géolocalisation dans macOS 13.3 à gauche et dans macOS 13.4 à droite

Comme l'a remarqué le site AAPL Ch., dans macOS 13.4, Apple a ajouté un détail : à l'intérieur du point bleu figure une petite flèche blanche. La signification de l'indicateur est ainsi beaucoup plus claire. Au bout de trois secondes, le rond bleu disparait, mais la flèche reste présente quelques secondes de plus. En fait, cet indicateur est maintenant parfaitement identique à celui d'iOS.

macOS 13.4

Comme pour l'indicateur orange d'utilisation du micro apparu dans Monterey, Apple ne donne pas la possibilité de désactiver l'affichage du petit point bleu — ce qui est assez logique puisqu'il s'agit d'une mesure de confidentialité visant à vous prévenir d'éventuelles utilisations abusives de votre Mac. Si le point orange vous embête pour une raison légitime, un utilitaire, Recording Indicator Utility, permet de le cacher, mais il demande de désactiver SIP pour bidouiller des fichiers du système."
: Did Nvidia just help create an AI-fueled stock bubble?,MarketWatch,2023-05-26T20:25:00Z,https://www.marketwatch.com/story/did-nvidia-just-help-create-an-ai-fueled-stock-bubble-ef607f51,"Tech stocks have roared back, but the current mania for artificial intelligence appears to expect too much too soon, which creates the possibility of a bubble.

Amid a first quarter of mostly mediocre growth and little in the way of guidance for the second half of the year, there was a lot of hype and hope about the future impact of AI. Big Tech stocks added more than $2 trillion in market capitalization in the first quarter, much of that based on hopes for the future and on some of these stocks now being viewed as havens in an economic storm.

Nvidia Corp. NVDA, +2.54% seemed to justify the investment this week, stunning Wall Street with a whopping projection for its next quarterly revenue target, fueled in part by sales of Nvidia chips to power AI-driven data centers. Those gains rippled throughout the tech sector, as investors were excited to see any company put some actual numbers on this frightening and awesome technology.

The theory would be that after that money surges into Nvidia, it will soon move to the companies buying the tech from Nvidia in order to live up to their AI hype. But that may not happen for years. Much of the tech sector will be in investing and spending mode for a while — which is great for Nvidia, but not a guarantee that other tech companies will soon see the same returns.

“It is somewhat unique to Nvidia,” said Daniel Newman, principal analyst and founding partner at Futurum Research. “Not only it is an arms race, it is a supply race. It’s pretty safe to say that the hyperscalers are leading this, then the biggest enterprises are next. They are trying to get their hands on every system they can get. They don’t know entirely why yet, they just know they need all the computing power they can get, every scrap of inventory they can get their hands on.”

More from Therese: Nvidia CFO on record-breaking forecast: ‘The inflection point of AI is here’

Newman likened the current spending spree on AI systems to building a structure when steel is in short supply. “So they are buying all the steel they can get their hands on and just laying it down on the job site.”

The rebound in tech stocks has pushed the Nasdaq Composite Index COMP, +2.19% out of the bear market it entered last year, but there is little evidence from the recent spate of earnings reports that growth has returned to the levels that justified tech’s pricey valuations. Investors seem to be betting on the unproven theory of a second-half rebound and near-term results from AI, while much of the tech sector — that is, just about every company not named Nvidia — still has a lot to prove about their near-term results and how AI will benefit their bank accounts.

Did earnings justify the tech-stock rebound?

As tech earnings season nears an end, we have seen stocks rise more than the results. The combined results from Alphabet Inc. GOOG, +0.87% GOOGL, +0.92% , Amazon.com Inc. AMZN, +4.44% , Apple Inc. AAPL, +1.41% , Meta Platforms Inc. META, +3.70% and Microsoft Corp. MSFT, +2.14% showed only slight revenue growth of 4% in the first calendar quarter, with total revenue of $373.2 billion, rising from $358.7 billion a year ago. That paltry 4% revenue growth pales in comparison with the double-digit growth of quarters past.

Net income fared slightly better, rising 7.5% to a combined net of $66.4 billion, up from $61.7 billion a year ago, but per-share earnings for Big Tech fell 5.3% from the same period in 2022 as companies continue to grow their share counts through stock compensation. Big Tech has so far outpaced the overall S&P 500 in revenue growth but saw a sharper decline in EPS.

Don’t miss: After a $2 trillion stock rebound, Big Tech wades into sea of uncertainty

Investors and analysts were still relieved by those results. After a $2 trillion rebound in the first quarter, shares of four of the top five companies were trading on average about 40% higher year to date, with Meta stock more than doubling as Wall Street applauded its massive cost-cutting moves. Both Alphabet and Apple hit 52-week highs last week. Nvidia, now close to reaching $1 trillion in market cap, may join the ranks of Big Tech soon, but it is not included in this data.

Wedbush Securities analyst Dan Ives called the quarter “a much better-than-feared earnings season for tech.” Overall strength in cloud computing helped Microsoft beat estimates amid a huge decline in the PC market, but Amazon signaled some concerns about AWS. A more stabilized internet advertising market helped Alphabet’s Google search and ad business. Meta saw its earnings decline, with only slight revenue growth, as the Facebook parent cut costs, but it gave a better-than-expected forecast. Apple saw a surprise jump in iPhone sales, fueled in part by strong performance in emerging markets.

“ ‘The economy has shown incredible resiliency over the past two quarters despite huge issues such as a banking crisis. Yet it’s quite possible that the wheels could fall off the bus with [third-quarter] earnings.’ ” — Maribel Lopez, Lopez Research principal analyst

“We were told it was going to be horrible, the market was going to crater, and what we saw was that tech is going to be more resilient,” Futurum’s Newman said.

Results from the largest tech companies papered over some overall weakness, however. According to Credit Suisse’s senior equities strategist, Manish Bangard, earnings for all tech companies included in the S&P 500 have underperformed when compared with the overall S&P 500 SPX, +1.30% .

Two weeks ago, with 85% of companies having reported, Bangard noted that revenue growth for S&P 500 companies was 3.7% and EPS was down 2.4%, while tech companies in the index saw revenue fall 3.1% and EPS fall 12%. The data did not include results from Nvidia and several others that reported this week.

The first quarter also saw many companies meeting or beating lowered expectations, and estimates are still being cut. According to FactSet and a MarketWatch analysis, analysts have cut their earnings estimates for half of the 72 tech companies in the S&P 500 since December. They have also cut estimates for 44 of those companies for 2024.

More from Therese: The streaming wars are destroying all that was good about streaming

As this column noted last month, the first-quarter earnings season for some tech companies was expected to be buoyed by cloud-computing projects, with one analyst noting she was worried about the summer.

“The economy has shown incredible resiliency over the past two quarters despite huge issues such as a banking crisis,” Maribel Lopez, principal analyst at Lopez Research, said in a recent email. “Yet it’s quite possible that the wheels could fall off the bus with [third-quarter] earnings. We see softening demand in areas such as retail, housing etc., which can’t be good for the overall economy.”

Indeed, the macroeconomy, jitters about the state of some regional banks and a looming debt-ceiling crisis are adding uncertainty to the mix, with some companies such as Apple citing macroeconomic uncertainty as the reason they are not giving much of a forecast. None of the Big Tech companies have provided a full annual forecast, with many executives citing the uncertain economic environment for the lack of more guidance.

Even Nvidia, which made the markets move with its forecast, declined to give guidance beyond the current quarter. When MarketWatch asked Nvidia Chief Financial Officer Colette Kress directly about her view beyond the current quarter, she would only say, “We have procured a substantial supply for the second half of the year. We have better visibility for a few quarters out. That is about as much as we can articulate now.”

Generative AI is now the ‘all-weather sport’

Newman noted that while investors are concerned about the macroeconomy, tech in many cases is going to be more appealing, especially now with the massive focus on AI. And Nvidia’s monster projection showed the promise of the technology.

Newman described the focus on generative AI as an “all-weather sport.” He also believes that generative AI, because it is being tested by the public in applications like Open AI’s ChatGPT and Google’s Bard, will be a great democratizer.

“It is being made available to companies smaller than ever before,” he said. “AI is going to find its way into companies, and it’s going to be the fastest disruption we have seen.”

See also: Congress and tech seem open to regulating AI efforts, but that doesn’t mean it will happen

On top of software companies like Microsoft MSFT, +2.14% and Alphabet’s Google that are offering AI embedded in search, tech firms ranging from chip makers to hardware makers to telecom companies will all eventually benefit from a big wave of investment in the technology, Newman noted. “When generative AI is done on the edge, that will force another wave of upgrades,” he said, referring to the eventual processing of AI queries on devices instead of in the cloud.

Quarterly reports were in some cases overshadowed by talk about artificial intelligence, but investors should know that the costs will arrive well before the benefits. Microsoft executives, for example, talked about higher capital spending on AI efforts. Alphabet too talked about higher spending for its data-center infrastructure, with AI also a part of that spending.

Read also: Microsoft and Alphabet increase spending on AI but don’t get carried away yet

This is where the possibility of a bubble exists. While investors are betting that other companies will soon see the same type of returns on AI that Nvidia expects this quarter, those companies may actually be shipping their money to Nvidia in hopes of getting a return years down the line. Wall Street expects earnings and revenue growth to turn around in the second half of the year, but if most of the tech sector is focused on spending to build for the future, that will not happen.

So while AI captured the most attention from investors this earnings season, especially after the Nvidia euphoria, they need to remember that there could be turbulence for the next few quarters. And spending on AI itself is going to mean a big investment cycle before some rewards are seen. Meanwhile, regulators are looking at whether they can put any guardrails on AI applications at this point.

Big Tech may be a haven for investors right now, with some caveats. As Newman pointed out, there has been a disproportionate flow of money into the big names, because “they have the most competitive technological moats.”

That applies to long-term bets, though. If Wall Street estimates are any indication of the rest of the year, they are pointing generally to continued lowered expectations. And if the numbers we see the rest of the year fail to compare to Nvidia’s monster forecast, the trillions poured into tech so far in 2023 could disappear just as fast."
