Title,Source,Published Date,URL,Content
Is It Too Late to Buy Apple Stock?,Motley Fool,2023-05-26T09:45:00Z,https://www.fool.com/investing/2023/05/26/is-it-too-late-to-buy-apple-stock/,"Apple (AAPL 1.41%) has been on fire in 2023, driven higher by the remarkable resilience of the iPhone and a recovery by a broad cross section of technology stocks. Shares of the iPhone maker are up 32% so far this year, more than four times the 7% gains of the S&P 500. This marks a reversal of fortune for Apple, as its stock lost roughly 27% last year.

The biggest contributor to its gains so far this year was Apple's better-than-expected financial results. Investors were surprised by just how well sales of the iPhone held up, which suggests that the struggling economy -- which has weighed on the stock -- could soon rebound.

What does this mean for those who missed out on Apple's current rally? Is now the time to buy in expectation of additional gains or avoid the stock due to its valuation and the economic volatility that remains? Let's take a look.

What's been weighing on Apple stock?

It's no secret that the principal driver of stocks and the broader market indexes during the past year or so has been the current economic conditions. The bear market was fueled by 40-year-high inflation and the resulting interest rate hikes designed to keep higher prices at bay. The economic uncertainty caused a pullback in consumer spending, which has resulted in slowing sales of the iPhone -- Apple's biggest seller.

This was clear in Apple's performance in fiscal 2022 (ended Sept. 24, 2022). Full-year revenue grew just 8%. While still respectable, it was a far cry from the 33% gains the company generated in 2021. As alarming as this might be for some investors, it's important to note that this is typical of a downturn. History is clear that when the economy begins to recover -- as it no doubt will -- consumers will return to normal spending habits, which will most likely include upgrading to the latest Apple device.

This suggests that pent-up demand could drive Apple stock higher once consumer discretionary spending returns to normal.

What (else) could drive Apple stock higher?

In addition to a recovery in consumer spending, there are other catalysts that could fuel Apple's stock rally.

The tech giant has a large and growing cadre of active devices -- and that number continues to grow. Earlier this year, CEO Tim Cook revealed that Apple had amassed an installed base of 2 billion active devices while also hitting new all-time highs in each of its major product categories.

This translates to more revenue for the company, the result of its growing ecosystem. For example, iPhone users tend to visit the App Store, spending money on apps. They also avail themselves of other services, like paying using Apple Pay, streaming Apple TV+, or subscribing to Apple Music. Each of these apps makes Apple's ecosystem stickier, increasing the likelihood that not only will users stay around, they will also choose from the company's growing list of services -- thereby boosting revenue.

Another potential opportunity is Apple's long-rumored mixed-reality headset, which is expected to combine elements of virtual reality with augmented reality. While the company has yet to confirm the existence of this as-yet-to-be-released product, several major news outlets have suggested the device will be introduced during Apple's developer conference on June 5. Estimates vary widely regarding the expected price for the device, but most reports suggest a cost of about $3,000, with sales of about 1 million during the first year of release.

The jury is still out regarding the potential demand for such a product, but Apple has a strong track record of creating demand for products that many believed would be flops -- including the iPad and Apple Watch.

Apple is also expanding its presence in a number of emerging markets. The company just launched its online store in Vietnam and recently opened its first retail store in India, the world's second-largest smartphone market. These moves will help Apple tap into new and lucrative opportunities.

How to approach Apple stock now

Apple is currently selling for roughly 22 times trailing earnings, a lower valuation than the price-to-earnings (P/E) ratio of 24 sported by the S&P 500. That's a pretty reasonable price to pay for a company with a strong history of growth.

As I illustrated above, Apple has a number of growth drivers that could spark a continuing stock rally over the longer term. Experienced investors with the discipline to withstand a little volatility should consider buying Apple now or adding to a position, particularly given the company's track record and the long runway ahead."
Dodging the Penalty: AOM's Star-Studded Line-Up Breathe Easy as EU Antitrust Inquiry Closes,Yahoo Entertainment,2023-05-23T15:38:45Z,https://finance.yahoo.com/news/dodging-penalty-aoms-star-studded-153845350.html,"Don't miss real-time alerts on your stocks - join Benzinga Pro for free! Try the tool that will help you invest smarter, faster, and better.

This article Dodging the Penalty: AOM's Star-Studded Line-Up Breathe Easy as EU Antitrust Inquiry Closes originally appeared on Benzinga.com

.

© 2023 Benzinga.com. Benzinga does not provide investment advice. All rights reserved."
Meta Loses Another EU Lawsuit Shortly After Hefty Penalty For Data Privacy Breach,Yahoo Entertainment,2023-05-24T13:00:08Z,https://finance.yahoo.com/news/meta-loses-another-eu-lawsuit-130008575.html,"Meta Loses Another EU Lawsuit Shortly After Hefty Penalty For Data Privacy Breach

Meta Platforms, Inc (NYSE: META) tasted defeat in a lawsuit with European Union regulators who ordered vast amounts of data to help build an antitrust case against the Facebook parent.

On Wednesday, the EU General Court, the bloc's second-highest court, ruled that Meta had failed to prove that the request ""went beyond what was necessary,"" Bloomberg reports.

The case dates back three years to when the European Commission started examining Meta's sales platform and how it uses app data.

Also Read: Meta Stock Falls Premarket: EU Slaps Company With Record $1.3B Penalty For Data Privacy Violation

While Meta says it cooperated and handed over a million documents, the company prosecuted the EU's executive arm in 2020, citing the comprehensive nature of the data requests.

In 2020 the EU court ordered the EU to work with Meta and store information in a virtual data room.

Scrutiny of Meta added to EU probes into Amazon.com Inc's (NASDAQ: AMZN) mode of data collection from retailers, which by now was settled, and investigations into Apple Inc's (NASDAQ: AAPL) app store.

Meta was hit with a formal EU complaint in December for allegedly squeezing out classified ad rivals by tying the Facebook Marketplace to its social network.

Price Action: META shares traded lower by 0.40% at $245.75 premarket on the last check Wednesday.

Don't miss real-time alerts on your stocks - join Benzinga Pro for free! Try the tool that will help you invest smarter, faster, and better.

This article Meta Loses Another EU Lawsuit Shortly After Hefty Penalty For Data Privacy Breach originally appeared on Benzinga.com

.

© 2023 Benzinga.com. Benzinga does not provide investment advice. All rights reserved."
Apple : que se passe-t-il avec les écrans d’iPhone ?,Freenews.fr,2023-05-24T06:00:00Z,https://www.freenews.fr/freenews-edition-nationale-299/apple-que-se-passe-t-il-avec-les-ecrans-diphone,"Au milieu de l’anticipation croissante pour les futurs modèles d’iPhone d’Apple Inc. (NASDAQ: AAPL), une déclaration récente de l’analyste renommé Ming-Chi Kuo suggère une situation potentiellement difficile pour les expéditions de Display Driver Integrated (DDI) de Novatek.

Il se passe quoi réellement ?

Lundi, Kuo, analyste chez TF International Securities, a révélé les perspectives du fournisseur d’Apple, Novatek, de manière assez surprenante, soulignant que les livraisons de composants DDI (Display Driver Integrated) pour iPhones seront potentiellement inférieures aux prévisions de l’année prochaine.

Kuo a imputé le déclin attendu à la prudence d’Apple dans l’ajout de nouveaux fournisseurs DDI, ce qui a entraîné une position conservatrice et pourrait avoir un impact sur le rôle de Novatek dans la chaîne d’approvisionnement de l’iPhone.

La réduction estimée des expéditions d’iPhone DDI de Novatek pour 2024 devrait dépasser 30%, ce qui pose un défi considérable à l’entreprise et fait penser aux réductions qui ont été opérées par Samsung sur certaines de ses filières de production, de l’ordre de 30% il y a encore quelques mois.

Kuo a également mis en lumière les défis auxquels sont confrontées les marques de smartphones Android.

Android, propriété d’Alphabet Inc. (NASDAQ: GOOG) est en effet le premier système d’exploitation pour smartphones, avec une part de marché de 71,1%, devant iOS d’Apple, qui détient une part de marché de 27,6%.

Pourquoi c’est important

Apple a vendu pour 42,6 milliards de dollars d’iPhones l’année dernière au quatrième trimestre, soit moins que les 43,4 milliards de dollars attendus par les experts. Cependant, en annonçant les résultats et les revenus du quatrième trimestre d’Apple, le PDG Tim Cook a déclaré qu’il ne s’agissait pas d’une baisse de la demande ou des dépenses des consommateurs, mais de problèmes de chaîne d’approvisionnement.

Les résultats financiers d’Apple pour le quatrième trimestre de 2021 ont également été inférieurs aux attentes, le géant de la technologie ayant été confronté à des problèmes avec sa chaîne d’approvisionnement qui ont eu un impact sur les ventes d’iPhone, entraînant une baisse des revenus."
3 Once-in-a-Generation Buying Opportunities for Patient Investors,Motley Fool,2023-05-23T10:00:00Z,https://www.fool.com/investing/2023/05/23/3-once-in-a-generation-buying-opportunities-for-pa/,"Legendary investors may have different strategies and preferences. But one thing that all great investors have in common is the coveted multibagger -- a position that increases several-fold over time.

We tend to think of multibaggers as small companies that have plenty of room for exponential growth. But multibaggers can also be hiding in plain sight. For example, Warren Buffett-led Berkshire Hathaway (NYSE: BRK.A)(NYSE: BRK.B) began loading up on Apple (NASDAQ: AAPL) stock in 2016. Over the last seven years, Apple stock is up a staggering 650% even though Apple was established when Berkshire began buying shares.

Deere & Company (DE 0.66%) and PTC (PTC 0.08%) are similar in that they are well-known, arguably undervalued positions that could become multibaggers over time. On the other hand, Joby Aviation (JOBY -1.65%) is a smaller company that falls more into that traditional ""hidden gem"" category. Here's why all three stocks could help foster generational wealth for patient investors.

Greener pastures ahead for Deere stock

Daniel Foelber (Deere): Despite Deere putting up quarter after quarter of impeccable results, investors remain skeptical about the company's sustained success. That skepticism has cast a cloud over Deere, which has seen its stock tumble as of late. However, context is key, as Deere is still up big over the last few years, trouncing the performance of the S&P 500 and Nasdaq Composite.

Deere reported a monster quarter on Friday, May 19, crushing top- and bottom-line expectations. The report was initially met with optimism before Deere stock began selling off, representing a volatile day of trading where the stock swung by over $31 per share from peak to trough.

Deere stock is beginning to look too cheap to ignore and is arguably one of the best low-risk opportunities out there today. Deere's updated guidance calls for a staggering $9.25 billion to $9.5 billion in net income for fiscal 2023. To say that Deere is enjoying a favorable time in the cycle would be an understatement.

In fiscal 2021, Deere's net income more than doubled in a single year to $5.96 billion, eclipsing its previous all-time high net income of $3.54 billion all the way back in fiscal 2013. Deere followed up fiscal 2021 with a new record of $7.13 billion in fiscal 2022. It was a good run, and even Deere was initially cautious about its outlook in fiscal 2023. But its updated guidance illustrates Deere's combination of pricing power, industry leadership, and ability to capitalize on a great time in its end markets.

This fiscal year, Deere is on track to make an amount of money that used to take three or four years to make. If it hits even the low end of its goal, Deere will make more net income in the three-year period from fiscal 2021 to fiscal 2023 than it did in the prior eight years combined.

These outsized profits could benefit investors in the short term through dividend raises and stock repurchases. But longer term, Deere will have even more dry powder to fuel its investments in sustainability, automation, and artificial intelligence.

Trading at a forward price-to-earnings (P/E) ratio of roughly 11.6, Deere stock is inexpensive. Although cyclical stocks tend to have low P/E ratios at the top of a cycle, Deere's valuation is particularly low and leaves a nice margin of error for the stock to remain cheap even if earnings fall.

All told, Deere has the makings of a lifelong investment for patient investors.

Take flight with Joby

Scott Levine (Joby Aviation): It's not everyday that the transportation industry is disrupted. But that's exactly what Joby is flying toward. Over the past 10 years, the company has developed electric vertical take-off and landing (eVTOL) aircraft which will be used to provide ride-sharing services for up to four passengers at a time. This innovative approach to transportation may seem like a pie-in-the-sky idea, but Joby is making real progress in executing its plan, and investors have a great opportunity to hitch a ride with the growth stock.

Nearly complete with the third of five stages in the Federal Aviation Administration's certification process, Joby plans on producing the first aircraft in 2023 that will adhere to the standards and design guidelines for the aircraft, which will be used for commercial operations. Should Joby remain on schedule with its development, it will commence commercial operations in 2025.

While the company's operations haven't taken off yet, it's still garnering considerable attention from a variety of sources. Providing a $55 million contract extension to Joby, the United States Air Force expects to receive two of Joby's eVTOL aircraft in 2024. In total, the U.S. Air Force's contract with Joby is valued at $131 million.

In addition to customers, Cathie Wood has taken note of Joby's potential. The Ark Autonomous Technology and Robotics ETF has consistently picked up shares in March and April, adding another 719,904 shares in May.

Still in the early phase of its development, Joby won't start generating revenue until 2025 if everything goes according to schedule. Consequently, only those committed to exercising patience -- and comfortable with a more speculative investment -- should consider hitching a ride with the disruptive ride-sharing company.

This growing company is only just getting started

Lee Samaha (PTC): The fourth industrial revolution, or industry 4.0, is real, and it pays investors to get early exposure to the theme. The grandiose title refers to the fusion of the physical and digital worlds in the industrial world. Digitally connecting the physical and digital world allows the latter to iteratively analyze, model, and improve behavior in the former. For example, think of a manufacturing plant digitally modeled to predict failures in service equipment sooner.

Digitization plays across all of PTC's solutions. For example, instead of its computer-aided design (CAD) and computer-aided manufacturing (CAM) software being used to design a part for an airplane, digitization allows the CAD/CAM user to redesign, analyze, and model a new version of the part before it's produced.

PTC's product-lifecycle management (PLM), an area in which PTC is the clear market leader, digitally manages the physical world. At the same time, its Internet of Things (IoT) software connects the physical and digital worlds. Finally, augmented reality (AR) solutions help optimize performance.

It's a compelling mix of technologies, and it is the future of industrial manufacturing -- a viewpoint backed up by PTC's expectation for 22% to 24% growth in annual run rate (ARR) in 2023. ARR refers to the ""annualized value of our portfolio of active subscription software, cloud, SaaS, and support contracts as of the end of the reporting period.""

While a valuation of 27 times the estimated free cash flow (FCF) for 2023 may seem high, note that the Wall Street consensus calls for 28% annual FCF growth over the next few years. If PTC hits these targets for FCF (it raised its full-year 2023 FCF guidance on its last earnings call), the current share price could look like a great buying opportunity."
"Apple May Be Warren Buffett's Best Business, but It's Not His Favorite Stock to Buy -- This Is",Motley Fool,2023-05-24T09:06:00Z,https://www.fool.com/investing/2023/05/24/apple-warren-buffett-not-his-favorite-stock-to-buy/,"Although Berkshire Hathaway (BRK.A 0.55%) (BRK.B 0.49%) isn't much of a household name, its CEO, billionaire Warren Buffett, certainly is. Since taking the reins at Berkshire Hathaway in the mid-1960s, the Oracle of Omaha has doubled up the annualized total return, including dividends paid, of the S&P 500 (19.8% versus 9.9%). This substantial long-term outperformance is what coerces more than 30,000 investors and shareholders to trek to Omaha, Nebraska, every year to listen to Warren Buffett speak.

The latest Berkshire Hathaway annual shareholder meeting didn't disappoint. The traditional five-hour question-and-answer session that Warren Buffett and executive vice chairman Charlie Munger grant members of the audience usually results in invaluable nuggets of wisdom being passed along, as well as gaining added insight into Buffett's investment/analysis process.

Perhaps the biggest reveal during the 2023 annual meeting was the Oracle of Omaha's true feelings about tech stock Apple (AAPL 1.41%), which is a pillar for Berkshire Hathaway, but technically isn't the Oracle of Omaha's favorite stock to buy.

""A better business than any we own""

On one hand, all you have to do is pull up any of Berkshire Hathaway's 13Fs to get a feeling for how Buffett and his investing lieutenants, Ted Weschler and Todd Combs, ""feel"" about Apple. As of last week, Apple accounted for more than 47% of Berkshire's $333 billion of invested assets. This includes the more than 20 million additional shares of Apple added during the first quarter by Buffett and his team.

However, the Oracle of Omaha made sure not to mince his words when challenged about the idea of Apple accounting for a potentially dangerous share of Berkshire Hathaway's invested assets during his company's annual meeting. Said Buffett:

But Apple is not 35% of Berkshire's portfolio. Berkshire's portfolio includes the railroad, the energy business, Garanimals, you name it, See's Candy. They're all businesses... They're good businesses. And to think that our criterion -- our criteria for Apple is different than the other businesses we own, it just happens to be a better business than any we own. And we put a fair amount of money in it, but we haven't got more money in it than we've got in the railroad. And Apple is a better business. Our railroad is a very good business. It was not remotely as good as Apple's business.

To be sure, Apple has checked all of Buffett's key points for some time. He certainly trusts the management team, which is headed by CEO Tim Cook. Not only is Apple continuing to lead the charge with the physical products that endeared the company with consumers (iPhone and Mac), but it's evolving with new subscription services. Apple's services segment should help the company minimize revenue fluctuations associated with iPhone replacement cycles, as well as bolster its operating margin over time.

Buffett also appreciates the value of a well-known brand. Apple is pretty consistently at or near the top of the list when it comes to brand value, and its customer base has proven exceptionally loyal. Subscription services should only enhance the loyalty of the company's customers.

And, of course, Warren Buffett's best business believes in rewarding its long-term shareholders. Apple is parsing out one of the largest nominal-dollar dividends among publicly traded companies, and it's repurchased a jaw-dropping $586 billion worth of its common stock over the past 10 years. Not including itself, Apple has spent more buying back its stock since 2013 than the market caps of 493 out of the other 499 S&P 500 companies.

Move over, Apple! This is Warren Buffett's undisputed favorite stock to buy

But here's something you might not realize: Despite Buffett's love for Apple, it's not his favorite stock to buy. In fact, it's not even close.

Normally, perusing Berkshire Hathaway's quarterly 13F filings will tell you everything you need to know about what Buffett and his investing lieutenants have been buying and selling. However, Berkshire's 13Fs aren't providing the complete picture regarding Warren Buffett's favorite stock to buy (cue ironic music)... Berkshire Hathaway.

Prior to mid-July 2018, the Oracle of Omaha and his right-hand man Charlie Munger were only allowed to repurchase shares of their company's stock if it fell to or below 120% of book value (i.e., no more than 20% above book value). For more than a half-decade leading up to mid-July 2018, Berkshire Hathaway's stock never hit this mark, leading to no share buybacks.

On July 17, 2018, things changed in a big way. Berkshire's board passed new measures that gave Buffett and Munger significantly more discretion to buy back their company's stock. As long as Berkshire Hathaway has at least $30 billion in cash, cash equivalents, and U.S. Treasuries on its balance sheet and both Buffett and Munger agree Berkshire's stock is trading below its intrinsic value, repurchases can be made with no ceiling or cap.

Since mid-July 2018, Buffett and Munger have overseen share buybacks every single quarter. During the recently ended first quarter, a little over 5,100 Class A shares were repurchased, along with close to 6.72 million Class B shares, which equated to almost $4.44 billion spent on share buybacks. In less than five years, Buffett has overseen the repurchase of $70 billion worth of his favorite stock, which is nearly double what's been spent purchasing shares of Apple since the beginning of 2016.

Since Berkshire Hathaway doesn't pay a dividend, share buybacks are an easy way to reward long-term investors. For starters, steadily buying back stock and lowering the outstanding share count increases the ownership stakes of existing shareholders. It's the same principle as Berkshire Hathaway becoming a large stakeholder in Apple without having to buy any additional shares.

What's more, buying back stock can have a positive impact on earnings per share (EPS). For businesses like Berkshire Hathaway that have steady or growing net income, a lower outstanding share count will provide a lift to EPS. Berkshire Hathaway is already a fundamentally attractive investment. Add on a stream of buybacks that boost its EPS over time, and it could become even more attractive.

Repurchasing $70 billion worth of Berkshire Hathaway stock in less than five years is also a clear indication from Buffett and Munger that they're confident in the business they've built. Many of the companies Berkshire owns and has invested in are cyclical, which means they're poised to take advantage of disproportionately long periods of economic expansion.

Therefore, no matter how much the Oracle of Omaha praises Apple, there's absolutely no question that Berkshire Hathaway is Warren Buffett's favorite stock to buy."
